{
  "name": "Example Title",
  "primaryipaddress": "example_value",
  "primaryport": 10,
  "type": "example_value",
  "state": "example_value",
  "curclntconnections": 42.5,
  "cursrvrconnections": 42.5,
  "establishedconn": 42.5,
  "curpersistencesessions": 42.5,
  "vslbhealth": 42.5,
  "actsvcs": 42.5,
  "inactsvcs": 42.5,
  "tothits": 42.5,
  "hitsrate": 42.5,
  "totalrequests": 42.5,
  "requestsrate": 42.5,
  "totalresponses": 42.5,
  "responsesrate": 42.5,
  "totalrequestbytes": 42.5,
  "requestbytesrate": 42.5,
  "totalresponsebytes": 42.5,
  "responsebytesrate": 42.5,
  "totalpktsrecvd": 42.5,
  "pktsrecvdrate": 42.5,
  "totalpktssent": 42.5,
  "pktssentrate": 42.5,
  "totalsvrbusyerr": 42.5,
  "svrbusyerrrate": 42.5,
  "surgecount": 42.5,
  "totspillovers": 42.5,
  "totvserverdownbackuphits": 42.5,
  "avgcltttlb": 42.5,
  "cltresponsetimeapdex": 42.5,
  "cpuusagepm": 42.5,
  "totalh2requests": 42.5,
  "h2requestsrate": 42.5,
  "totalh2responses": 42.5,
  "h2responsesrate": 42.5,
  "invalidrequestresponse": 42.5,
  "invalidrequestresponsedropped": 42.5,
  "sothreshold": 42.5,
  "reqretrycount": 42.5,
  "reqretrycountexceeded": 42.5,
  "deferredreq": 42.5,
  "deferredreqrate": 42.5
}